### ISSUE TITLE
SSL 双向认证问题

### ISSUE THREAD

**Issue by honglidong** [guanzhi/GmSSL#716]
SSL Server 使用 ECC_SM4_SM3  算法。 在server 不要求客户端提供证书时，SSL client 使用
gmssl s_client  -connect 10.177.220.155:443 -msg -debug -gmtls -state -verifyCAfile CA.cert.pem 可以和server建立连接。
但当server 要求客户端提供证书时出问题了：
1、gmssl s_client 命令好像只能设置一本证书（通过 -key 和 -cert 参数），怎么同时设置签名证书和加密证书？
2、当我设置一本证书时，客户端连接报错，具体信息如下：
gmssl s_client -cert ./sm2Certs/CS.cert.pem -key ./sm2Certs/CS.key.pem  -connect 10.177.220.155:443 -msg -debug -gmtls -state -verifyCAfile CA.cert.pem

客户端发送的证书报文格式错误，抓包发现证书长度字段错误 Certificate Length: 3179009。具体信息如下：
1、gmssl的debug信息
read from 0x18211b0 [0x182a733] (5 bytes => 5 (0x5))
0000 - 15 01 01 00 02                                    .....
<<< ??? [length 0005]
    15 01 01 00 02
read from 0x18211b0 [0x182a738] (2 bytes => 2 (0x2))
0000 - 02 32                                             .2
<<< GMTLS 1.1 [length 0002]
    02 32
SSL3 alert read:fatal:decode error
SSL_connect:error in SSLv3/TLS write finished
139847784654656:error:1409441A:SSL routines:ssl3_read_bytes:tlsv1 alert decode error:ssl/record/rec_layer_s3.c:1385:SSL alert number 50
---
Certificate chain
 0 s:/C=CN/ST=BJ/L=HaiDian/O=Beijing JNTA Technology LTD./OU=BSRC of TASS/CN=server sign (SM2)
   i:/C=CN/ST=BJ/L=HaiDian/O=Beijing JNTA Technology LTD./OU=SORB of TASS/CN=Test CA (SM2)
 1 s:/C=CN/ST=BJ/L=HaiDian/O=Beijing JNTA Technology LTD./OU=BSRC of TASS/CN=server enc (SM2)
   i:/C=CN/ST=BJ/L=HaiDian/O=Beijing JNTA Technology LTD./OU=SORB of TASS/CN=Test CA (SM2)
 2 s:/C=CN/ST=BJ/L=HaiDian/O=Beijing JNTA Technology LTD./OU=SORB of TASS/CN=Test CA (SM2)
   i:/C=CN/ST=BJ/L=HaiDian/O=Beijing JNTA Technology LTD./OU=SORB of TASS/CN=Test CA (SM2)
---
Server certificate
-----BEGIN CERTIFICATE-----
MIICHDCCAcGgAwIBAgIJAKBmp5dFqmiCMAoGCCqBHM9VAYN1MIGCMQswCQYDVQQG
EwJDTjELMAkGA1UECAwCQkoxEDAOBgNVBAcMB0hhaURpYW4xJTAjBgNVBAoMHEJl
aWppbmcgSk5UQSBUZWNobm9sb2d5IExURC4xFTATBgNVBAsMDFNPUkIgb2YgVEFT
UzEWMBQGA1UEAwwNVGVzdCBDQSAoU00yKTAeFw0xODA2MTQxMDI0NTlaFw0yMjA3
MjMxMDI0NTlaMIGGMQswCQYDVQQGEwJDTjELMAkGA1UECAwCQkoxEDAOBgNVBAcM
B0hhaURpYW4xJTAjBgNVBAoMHEJlaWppbmcgSk5UQSBUZWNobm9sb2d5IExURC4x
FTATBgNVBAsMDEJTUkMgb2YgVEFTUzEaMBgGA1UEAwwRc2VydmVyIHNpZ24gKFNN
MikwWTATBgcqhkjOPQIBBggqgRzPVQGCLQNCAASlRhG16wvYZqa3Ru0t1JbseoKc
Cs8oAwCtQYLx7AXRA9K3koSNfvn6WOKRhfAsdHbrjhFqDdwyFt+gYzFvPgV6oxow
GDAJBgNVHRMEAjAAMAsGA1UdDwQEAwIGwDAKBggqgRzPVQGDdQNJADBGAiEAvrFL
uevLgzD+s5d9z2rQM3s+rSPBzSJWYHBpcOdrMpMCIQCbhCR1W0B2T8qc/D/9HAFA
lNtYDNigsmbKfdp3pvt2Mw==
-----END CERTIFICATE-----
subject=/C=CN/ST=BJ/L=HaiDian/O=Beijing JNTA Technology LTD./OU=BSRC of TASS/CN=server sign (SM2)
issuer=/C=CN/ST=BJ/L=HaiDian/O=Beijing JNTA Technology LTD./OU=SORB of TASS/CN=Test CA (SM2)
---
No client certificate CA names sent
Client Certificate Types: RSA sign, DSA sign
---
SSL handshake has read 1874 bytes and written 1496 bytes
Verification: OK
---
New, GMTLSv1.1, Cipher is SM2-WITH-SMS4-SM3
Server public key is 256 bit
Secure Renegotiation IS NOT supported
Compression: NONE
Expansion: NONE
No ALPN negotiated
SSL-Session:
    Protocol  : GMTLSv1.1
    Cipher    : SM2-WITH-SMS4-SM3
    Session-ID:
    Session-ID-ctx:
    Master-Key: 48CBCBB829F2B3654C2ADD7AC3072F79D85C53C9BB5E9BD620EA7D9AD1988E749F756B84D0033B3FF5A379FA05F70EBD
    PSK identity: None
    PSK identity hint: None
    SRP username: None
    Start Time: 1552456739
    Timeout   : 7200 (sec)
    Verify return code: 0 (ok)
    Extended master secret: no
---
root@HGH1000060650:/usr1/hongld/GmSSL-master#

2、报文抓包信息
Frame 9: 947 bytes on wire (7576 bits), 947 bytes captured (7576 bits) on interface 0
Ethernet II, Src: 00:ff:aa:ed:b4:57 (00:ff:aa:ed:b4:57), Dst: HuaweiTe_83:20:25 (e4:68:a3:83:20:25)
Internet Protocol Version 4, Src: 4.1.94.54, Dst: 4.1.73.105
Transmission Control Protocol, Src Port: 62164 (62164), Dst Port: https (443), Seq: 63, Ack: 1868, Len: 893
Secure Sockets Layer
    GMSSLv1 Record Layer: Handshake Protocol: Certificate
        Content Type: Handshake (22)
        Version: GMSSL 1.0 (0x0101)
        Length: 548
        Handshake Protocol: Certificate
            Handshake Type: Certificate (11)
            Length: 544
            Certificates Length: 541
            Certificates (541 bytes)
                Certificate Length: 3179009
    GMSSLv1 Record Layer: Handshake Protocol: Client Key Exchange
        Content Type: Handshake (22)
        Version: GMSSL 1.0 (0x0101)
        Length: 162
        Handshake Protocol: Client Key Exchange
            Handshake Type: Client Key Exchange (16)
            Length: 158
    GMSSLv1 Record Layer: Handshake Protocol: Certificate Verify
        Content Type: Handshake (22)
        Version: GMSSL 1.0 (0x0101)
        Length: 77
        Handshake Protocol: Certificate Verify
            Handshake Type: Certificate Verify (15)
            Length: 73
            Signature Algorithm: None Unknown (0x0047)
            Signature length: 12357
    GMSSLv1 Record Layer: Change Cipher Spec Protocol: Change Cipher Spec
        Content Type: Change Cipher Spec (20)
        Version: GMSSL 1.0 (0x0101)
        Length: 1
        Change Cipher Spec Message
    GMSSLv1 Record Layer: Handshake Protocol: Encrypted Handshake Message
        Content Type: Handshake (22)
        Version: GMSSL 1.0 (0x0101)
        Length: 80
        Handshake Protocol: Encrypted Handshake Message
0000   16 01 01 02 24 0b 00 02 20 00 02 1d 30 82 01 c1
0010   a0 03 02 01 02 02 09 00 a0 66 a7 97 45 aa 68 84
0020   30 0a 06 08 2a 81 1c cf 55 01 83 75 30 81 82 31
0030   0b 30 09 06 03 55 04 06 13 02 43 4e 31 0b 30 09
0040   06 03 55 04 08 0c 02 42 4a 31 10 30 0e 06 03 55
0050   04 07 0c 07 48 61 69 44 69 61 6e 31 25 30 23 06
0060   03 55 04 0a 0c 1c 42 65 69 6a 69 6e 67 20 4a 4e
0070   54 41 20 54 65 63 68 6e 6f 6c 6f 67 79 20 4c 54
0080   44 2e 31 15 30 13 06 03 55 04 0b 0c 0c 53 4f 52
0090   42 20 6f 66 20 54 41 53 53 31 16 30 14 06 03 55
00a0   04 03 0c 0d 54 65 73 74 20 43 41 20 28 53 4d 32
00b0   29 30 1e 17 0d 31 38 30 36 31 34 31 30 32 34 35
00c0   39 5a 17 0d 32 32 30 37 32 33 31 30 32 34 35 39
00d0   5a 30 81 86 31 0b 30 09 06 03 55 04 06 13 02 43
00e0   4e 31 0b 30 09 06 03 55 04 08 0c 02 42 4a 31 10
00f0   30 0e 06 03 55 04 07 0c 07 48 61 69 44 69 61 6e
0100   31 25 30 23 06 03 55 04 0a 0c 1c 42 65 69 6a 69
0110   6e 67 20 4a 4e 54 41 20 54 65 63 68 6e 6f 6c 6f
0120   67 79 20 4c 54 44 2e 31 15 30 13 06 03 55 04 0b
0130   0c 0c 42 53 52 43 20 6f 66 20 54 41 53 53 31 1a
0140   30 18 06 03 55 04 03 0c 11 63 6c 69 65 6e 74 20
0150   73 69 67 6e 20 28 53 4d 32 29 30 59 30 13 06 07
0160   2a 86 48 ce 3d 02 01 06 08 2a 81 1c cf 55 01 82
0170   2d 03 42 00 04 10 66 89 93 0f 79 a6 b5 3c 4c 52
0180   4e 75 8f 21 62 3f 32 b9 cb 89 03 02 6f a0 9e 70
0190   03 a3 01 3b 4a 3a 53 5a 7d d9 d2 79 32 a0 b5 fd
01a0   01 e8 59 b8 76 20 7a df 43 23 3e fa 0b 1e f0 2e
01b0   d2 76 2d 9d e9 a3 1a 30 18 30 09 06 03 55 1d 13
01c0   04 02 30 00 30 0b 06 03 55 1d 0f 04 04 03 02 06
01d0   c0 30 0a 06 08 2a 81 1c cf 55 01 83 75 03 47 00
01e0   30 44 02 20 13 15 98 18 18 71 ab 72 d5 52 bd 16
01f0   41 89 78 90 c1 d9 06 63 3f e5 17 7e 16 bc 5c 61
0200   ab 90 af 94 02 20 43 b2 85 64 6e 42 78 3e 6a 12
0210   f7 39 ba 44 cd 30 db bc d4 1b 81 bf 49 df 39 98
0220   26 4d 12 ef 24 e1 00 00 00

**Comment by honglidong** [comment]
@guanzhi  关老师，gmtls_construct_client_certificate 这个函数是不是有问题？长度好像错了
int gmtls_construct_client_certificate(SSL *s)
{
	int al = -1;
	unsigned long alg_a = s->s3->tmp.new_cipher->algorithm_auth;
	unsigned char *p;
	int l;

	l = 3 + SSL_HM_HEADER_LENGTH(s);//这个函数是不是少了这一行？？

	if (alg_a & SSL_aSM2) {
		if (!gmtls_construct_sm2_certs(s, &l)) {
			SSLerr(SSL_F_GMTLS_CONSTRUCT_CLIENT_CERTIFICATE,
				ERR_R_INTERNAL_ERROR);
			goto err;
		}
	} else if (alg_a & SSL_aRSA) {
		if (!gmtls_construct_rsa_certs(s, &l)) {
			SSLerr(SSL_F_GMTLS_CONSTRUCT_CLIENT_CERTIFICATE,
				ERR_R_INTERNAL_ERROR);
			goto err;
		}
	} else if (alg_a & SSL_aSM9) {
		if (!gmtls_construct_ibs_params(s, &p, &l, &al)) {
			SSLerr(SSL_F_GMTLS_CONSTRUCT_CLIENT_CERTIFICATE,
				ERR_R_INTERNAL_ERROR);
			goto err;
		}
	}  else {
		SSLerr(SSL_F_GMTLS_CONSTRUCT_CLIENT_CERTIFICATE,
			ERR_R_INTERNAL_ERROR);
		goto err;
	}

	if (!ssl_set_handshake_header(s, SSL3_MT_CERTIFICATE, l)) {
		SSLerr(SSL_F_GMTLS_CONSTRUCT_CLIENT_CERTIFICATE,
			ERR_R_INTERNAL_ERROR);
		return 0;
	}

	return 1;

err:
	ssl3_send_alert(s, SSL3_AL_FATAL, SSL_AD_INTERNAL_ERROR);
	ossl_statem_set_error(s);
	return 0;
}

**Comment by honglidong** [comment]
当使用 ECC_SM4_SM3 算法时，双向认证 客户端发送验证消息时，要使用签名证书的key进行签名，不然 server验证会失败。
    #ifndef OPENSSL_NO_GMTLS
    if (SSL_IS_GMTLS(s) && s->cert->pkeys[SSL_PKEY_SM2].privatekey)
        pkey = s->cert->pkeys[SSL_PKEY_SM2].privatekey;
    else
    #endif
    pkey = s->cert->key->privatekey;
这样修改后，server 侧验证OK。

**Comment by elitetony** [comment]
> 
> 
> 当使用 ECC_SM4_SM3 算法时，双向认证 客户端发送验证消息时，要使用签名证书的key进行签名，不然 server验证会失败。
> #ifndef OPENSSL_NO_GMTLS
> if (SSL_IS_GMTLS(s) && s->cert->pkeys[SSL_PKEY_SM2].privatekey)
> pkey = s->cert->pkeys[SSL_PKEY_SM2].privatekey;
> else
> #endif
> pkey = s->cert->key->privatekey;
> 这样修改后，server 侧验证OK。

请问一下，双向认证的测试命令是什么样的啊。你加载双证书用的什么参数？

**Comment by yangcy001** [comment]
第二个使用 ECC_SM4_SM3 算法时，在哪里修改呢

**Comment by Jianfeng-Du** [comment]
多谢提供的两处修改，双向认证改这两处后顺利解决问题

第二处的位置在这 [https://github.com/guanzhi/GmSSL/blob/master/ssl/statem/statem_clnt.c#L2775](url)

**Comment by reclock** [comment]
> 多谢提供的两处修改，双向认证改这两处后顺利解决问题
> 
> 第二处的位置在这 [tls_construct_client_verify 函数](https://github.com/guanzhi/GmSSL/blob/master/ssl/statem/statem_clnt.c#L2775)
> 
> ```c
> int tls_construct_client_verify(SSL *s)
> {
>     unsigned char *p;
>     EVP_PKEY *pkey;
>     const EVP_MD *md = s->s3->tmp.md[s->cert->key - s->cert->pkeys];
>     EVP_MD_CTX *mctx;
>     unsigned u = 0;
>     unsigned long n = 0;
>     long hdatalen = 0;
>     void *hdata;
>     mctx = EVP_MD_CTX_new();
> 
>     if (mctx == NULL) {
>         SSLerr(SSL_F_TLS_CONSTRUCT_CLIENT_VERIFY, ERR_R_MALLOC_FAILURE);
>         goto err;
>     }
> 
>     p = ssl_handshake_start(s);
> 
> /* 这是新添加的 */
> #ifndef OPENSSL_NO_GMTLS
> if (SSL_IS_GMTLS(s) && s->cert->pkeys[SSL_PKEY_SM2].privatekey)
> pkey = s->cert->pkeys[SSL_PKEY_SM2].privatekey;
> else
> #endif
> /* 新添加的结束 */
> 
>     pkey = s->cert->key->privatekey;
> ```
> 
> 通过我自己加的打印发现，修改后使用的 pkey 为签名证书对应的公私钥信息，而修改前使用的是加密证书对应的公私钥信息。个人理解这个 bug 是因为错误的使用了加密证书对应的私钥来签名，如理解错误请大家指正。

两处都是修改的哪个地方，我也到双向认证的问题了，改了还是不行呢
